	Word	Context	Spacy POS
426	takeoff	just a little pre- takeoff takeoff.	NN
427	nothing	master, monks have nothing nothing to requite	NN
428	lock	# boom sha lock lock boom!	VB
429	lock	# boom sha lock lock boom!	VB
430	lock	# boom sha lock lock boom!	VB
431	lock	# the cartoon boom sha lock lock	VB
432	lock	# boom sha lock lock boom!	VB
433	lock	# boom sha lock lock boom!	VB
434	lock	# boom sha lock lock boom!	VB
435	lock	boom sha lock lock boom!	VB
436	takeoff	just a little pre- takeoff takeoff.	NN
437	lock	boom sha lock lock boom!	VB
438	lock	boom sha lock lock boom!	VB
439	lock	boom sha lock lock boom!	VB
440	lock	the cartoon boom sha lock lock	VB
441	lock	boom sha lock lock boom!	VB
442	lock	boom sha lock lock boom!	VB
443	lock	boom sha lock lock boom!	VB
444	lock	boom sha lock lock boom!	VB
445	sure	oh sure sure, please, sit.	RB
446	long	i was soon relieved of my position where i have a long long forest of tendencies to tell the truth... in a country where they never say what they need.	RB
447	sure	oh sure sure, please, sit.	RB
448	number	number number haha	NN
449	damn	damn damn haha the day kills of	RB
450	car	car car	NN
451	here	leave to leave here here	RB
452	walk	walk walk	VB
453	long	i was soon relieved of my position where i have a long long forest of tendencies to tell the truth... in a country where they never say what they need.	RB
454	away	it' s a crime share it fairly, but don' t take a slice of my pie money, so they say is the root of all evil today but if you ask for a raise it' s no surprise they' re giving none away away... away... away... away... away... away... away... away... away... away... away... away... away... away... away... away... away... away... away... away... away... away... away... away... away... away... away... away... away...	RB
455	wait	wait wait, captain.	VB
456	then	then then only thing you need to learn is to obey!	RB
457	sing	released from sing sing prison friday.	VB
458	far	that i' il save her from whatever she' s scared of and take her far far away	RB
459	very	that is either the best of wives, or the very very worst.	RB
460	coastal	i guess a little a few little in coastal coastal area.	JJ
461	sing	two hundred souls passed through this wood and steel at sing sing.	VB
462	far	that i' il save her from whatever she' s scared of and take her far far away.	RB
463	sing	two hundred souls passed through this wood and steel at sing sing.	VB
464	pathetic	you' re pathetic pathetic	JJ
465	far	that i' il save her from whatever she' s scared of and take her far far away	RB
466	fix	they fix fix me a pretty decent steak for my last meal	VB
467	pathetic	you' re pathetic pathetic	JJ
468	easy	easy easy...	JJ
469	hula	so where are all the surfers and hula hula dancers, smart guy?	NN
470	shame	shame shame	NN
471	tin	- fuck you, tin tin.	NN
472	tin	oh, what is this, tin tin?	NN
473	tin	it was pawned here a year ago by a customer of yours named tin tin.	NN
474	tin	that' s tin tin, one of t- bird' s little helpers.	NN
475	tin	now you' re going to tell me where to find... the rest of tin tin' s little party pals.	NN
476	tin	you' re the guy that murdered tin tin.	NN
477	tin	- tin tin.	NN
478	tin	gentlemen, by all means, i think we ought to have... an introspective moment of silence for poor, old tin tin.	NN
479	tin	that piece of ratshit made tin tin into a fuckin 'voodoo doll!	NN
480	tin	tin tin was a dick.	NN
481	tin	tin tin.	NN
482	tin	you did tin tin.	NN
483	brother	he' s your brother brother?	NN
484	time	it' s good- time time.	NN
485	high	we gonna get a high high.	JJ
486	rrr	rrr rrr!	NN
487	squeak	squeak squeak!	NN
488	rrr	rrr rrr!	NN
489	again	we' re hit again again!	RB
490	fire	it all seems so long ago young and happy don' t you know down by the creek i would show fireflies to that girl but that was back when he was nice before my warm heart turned to ice my sister' s wig once had lice but that was long ago the schoolyard' s where we were the first time i kissed her he thought he got some tongue but it was only retainer eleanore' s bra is a trainer well, over there' s my family home and the woods we used to roam the only time i had sex was on the phone but that was long ago i carved our names upon that tree i loved him and he loved me my darling wife was once a he but that was long ago he' d always whisper in my ear but then i started drinking beer my jewels got licked by six frisky deer now he' s just a loner and a liar and my trailer' s caught on fire fire?!	NN
491	sorry	sorry. sorry sorry	JJ
492	abra	hockety pockety wockety whack abra abra dabra nack	VB
493	wait	wait wait, you can' t...	VB
494	wait	wait wait, i' m not part of this!	VB
495	look	look look	VB
496	whoa	- workin 'at the car wash - whoa whoa yeah yeah	NN
497	tut	now, tut tut.	JJ
498	whoa	- # workin 'at the car wash - # whoa whoa yeah yeah	NN
499	now	now now there sissyboy, don' t cry you little animal tormentor	RB
500	square	left circle double left square right to the down square square.	JJ
501	very	and the price is... very very low.	RB
502	whoa	- workin 'at the car wash - whoa whoa yeah yeah	NN
503	really	- really really.	RB
504	really	- really really.	RB
505	toot	toot toot!	VB
506	really	listen, you were really really something, back there.	RB
507	really	- really really.	RB
508	far	batch leeret number one is a mostly abuse shading from a kindom far far away.	RB
509	really	- really really.	RB
510	really	really really.	RB
511	there	come on please be there there it is just like randall said	RB
512	very	very very far!	RB
513	very	very very far!	RB
514	doot	hoo doot doo doot doot doo doot	NN
515	doot	* hoo doot doo doot doot doo doot *	NN
516	ever	don' t you ever ever do this again!	RB
517	hunka	a super- duper, extra- looper, hunka hunka heffatrap.	NN
518	sugar	# sugar sugar 	NN
519	not	i meant, no, i do not not wish to be married.	RB
520	here	the bride is here here comes the bride	RB
521	not	i meant, no, i do not not wish to be married.	RB
522	here	the bride is here here comes the bride	RB
523	not	i meant, no, i do not not wish to be married.	RB
524	here	the bride is here here comes the bride	RB
525	not	i meant, no, i do not not wish to be married.	RB
526	here	the bride is here here comes the bride	RB
527	many	many many friends	JJ
528	many	many many friends	JJ
529	new	by the power vested in me by the state of new new york	JJ
530	deadly	it don' t take more than deadly deadly bees to keep us from doing our job.	JJ
531	deadly	it' il take more than a few deadly deadly bees to... »	JJ
532	boo	that' s a boo boo tops!	NN
533	late	 it' s the late late show with craig kilborn.	RB
534	hip	hip hip!	NN
535	hip	- hip hip!	NN
536	hip	hip hip!	NN
537	else	anybody else else?	RB
538	cluck	* cluck cluck, said the little red hen let' s boogie in the barnyard *	NN
539	circus	well, that' s a change of pace... our accidental tourist took his family backstage at circus circus.	NN
540	circus	backstage at circus circus.	NN
541	wild	- i got a wild wild life - don' tyou ever stop?	JJ
542	widow	i mean, i' ve always been a black widow... but now i' m a black widow widow.	NN
